<?xml version="1.0" encoding="UTF-8"?>
<tns:CertificateSigningRequest xmlns:ds="http://www.w3.org/2000/09/xmldsig#" xmlns:tns="urn:be:fedict:eid:pkira:contracts"
	xmlns:xsi="http://www.w3.org/2001/XMLSchema-instance"
	xsi:schemaLocation="urn:be:fedict:eid:pkira:contracts ../../../../../../../../../../eid-pki-ra-generated-contracts/src/main/resources/xsd/eid-pki-ra.xsd ">
	<tns:RequestId>REQ-123</tns:RequestId>
	<tns:Description>Test</tns:Description>
	<tns:Operator>
		<tns:Name>Jan</tns:Name>
		<tns:Function>Tester</tns:Function>
		<tns:Phone>1234</tns:Phone>
        <tns:Email>j.vandenbergh@aca-it.be</tns:Email>
	</tns:Operator>
	<tns:LegalNotice>Legal notice</tns:LegalNotice>
	<tns:DistinguishedName>C=BE,ST=Limburg,L=Hasselt,O=ACA,OU=test,CN=Jan Van den Bergh</tns:DistinguishedName>
	<tns:CertificateType>Server</tns:CertificateType>
	<tns:ValidityPeriodMonths>15</tns:ValidityPeriodMonths>
	<tns:CSR>
-----BEGIN NEW CERTIFICATE REQUEST-----
MIICbzCCAi0CAQAwajELMAkGA1UEBhMCQkUxEDAOBgNVBAgTB0xpbWJ1cmcxEDAOBgNVBAcTB0hh
c3NlbHQxDDAKBgNVBAoTA0FDQTENMAsGA1UECxMEdGVzdDEaMBgGA1UEAxMRSmFuIFZhbiBkZW4g
QmVyZ2gwggG4MIIBLAYHKoZIzjgEATCCAR8CgYEA/X9TgR11EilS30qcLuzk5/YRt1I870QAwx4/
gLZRJmlFXUAiUftZPY1Y+r/F9bow9subVWzXgTuAHTRv8mZgt2uZUKWkn5/oBHsQIsJPu6nX/rfG
G/g7V+fGqKYVDwT7g/bTxR7DAjVUE1oWkTL2dfOuK2HXKu/yIgMZndFIAccCFQCXYFCPFSMLzLKS
uYKi64QL8Fgc9QKBgQD34aCF1ps93su8q1w2uFe5eZSvu/o66oL5V0wLPQeCZ1FZV4661FlP5nEH
EIGAtEkWcSPoTCgWE7fPCTKMyKbhPBZ6i1R8jSjgo64eK7OmdZFuo38L+iE1YvH7YnoBJDvMpPG+
qFGQiaiD3+Fa5Z8GkotmXoB7VSVkAUw7/s9JKgOBhQACgYEA+86jKc18tmTaU44RdbeQIkBi5R4q
KGvWiuoIcoKaQswraNkLzlGLlJbsfIGA+aZbqaZkvNKpRU+7OVwW1FBuPCaXuhDL315XvLQ/kz4/
Ft5x70OccrJqzTxecvUyjwTrhehyxURBZ4e+oCrYp9py3zMmy2qDDWIN1IYTdF+VzxSgADALBgcq
hkjOOAQDBQADLwAwLAIUcQtBbLV6WliL6xr6yFg5IMYMjfsCFB4D9BUGyFYRNvHFms7ySKKdg+Md
-----END NEW CERTIFICATE REQUEST-----
	</tns:CSR>
</tns:CertificateSigningRequest>
